{"$schema":"https://json-schema.org/draft/2020-12/schema","$id":"urn:open-brain:portable-brain:v1:proposal","type":"object","properties":{"actor_id":{"$ref":"urn:open-brain:portable-brain:v1:common#/$defs/actor_id"},"capture_ids":{"type":"array","items":{"$ref":"urn:open-brain:portable-brain:v1:common#/$defs/capture_id"},"minItems":1,"uniqueItems":true},"evidence":{"type":"array","minItems":1,"items":{"type":"object","properties":{"capture_id":{"$ref":"urn:open-brain:portable-brain:v1:common#/$defs/capture_id"},"excerpt":{"type":"string","minLength":1},"sha256":{"$ref":"urn:open-brain:portable-brain:v1:common#/$defs/digest"}},"required":["capture_id","excerpt","sha256"],"additionalProperties":false}},"expected_receipt":{"$ref":"urn:open-brain:portable-brain:v1:common#/$defs/receipt"},"privacy":{"$ref":"urn:open-brain:portable-brain:v1:common#/$defs/privacy"},"proposal_id":{"$ref":"urn:open-brain:portable-brain:v1:common#/$defs/proposal_id"},"proposed_content":{"type":"object","properties":{"bytes_base64":{"type":"string","minLength":1},"media_type":{"type":"string","minLength":1},"sha256":{"$ref":"urn:open-brain:portable-brain:v1:common#/$defs/digest"}},"required":["bytes_base64","media_type","sha256"],"additionalProperties":false},"proposed_kind":{"enum":["page_update","event","measurement","action"]},"recorded_at":{"$ref":"urn:open-brain:portable-brain:v1:common#/$defs/timestamp"},"role_claim":{"$ref":"urn:open-brain:portable-brain:v1:common#/$defs/role_claim"},"schema_version":{"const":1},"sibling_context":{"type":"object","properties":{"proposal_ids":{"type":"array","items":{"$ref":"urn:open-brain:portable-brain:v1:common#/$defs/proposal_id"},"minItems":1,"uniqueItems":true}},"required":["proposal_ids"],"additionalProperties":false},"space_id":{"oneOf":[{"$ref":"urn:open-brain:portable-brain:v1:common#/$defs/space_id"},{"type":"null"}]},"status":{"const":"pending"},"supplied_reason":{"type":["string","null"]},"tenant_id":{"$ref":"urn:open-brain:portable-brain:v1:common#/$defs/tenant_id"},"trust":{"$ref":"urn:open-brain:portable-brain:v1:common#/$defs/trust"}},"required":["actor_id","capture_ids","evidence","expected_receipt","privacy","proposal_id","proposed_content","proposed_kind","recorded_at","role_claim","schema_version","sibling_context","space_id","status","supplied_reason","tenant_id","trust"],"additionalProperties":false}
