{"actor_id":"actor_123e4567-e89b-42d3-a456-426614174001","capture_ids":["capture_123e4567-e89b-42d3-a456-426614174100"],"evidence":[{"capture_id":"capture_123e4567-e89b-42d3-a456-426614174100","excerpt":"synthetic evidence","sha256":"48736e58b409ed0241c8d7bed9dc188a59e13002f48e7492850bec15b59147b6"}],"expected_receipt":{"kind":"proposal_created","payload":{"proposal_id":"proposal_123e4567-e89b-42d3-a456-426614174008","proposed_content_sha256":"0618524be78e28b615fb58bf6dd8470b86632f0d9338803917a09ece72b9d43d"},"receipt_id":"receipt_123e4567-e89b-42d3-a456-426614174120","recorded_at":"2026-08-30T12:00:00Z","sha256":"b5cf4bf2d1b9df6e492890f0d12f2de098003798ae02a49be983e56b055dc367","subject_id":"proposal_123e4567-e89b-42d3-a456-426614174008"},"privacy":{"authority":{"cloud":false,"external_egress":false},"confirmation_ref":null,"policy_version":"privacy-v1","reason":"personal_local_only","tier":"personal"},"proposal_id":"proposal_123e4567-e89b-42d3-a456-426614174008","proposed_content":{"bytes_base64":"IyBQcm9wb3NlZCBzeW50aGV0aWMgcGFnZQo=","media_type":"text/markdown","sha256":"0618524be78e28b615fb58bf6dd8470b86632f0d9338803917a09ece72b9d43d"},"proposed_kind":"page_update","recorded_at":"2026-08-30T12:05:00Z","role_claim":{"actor_id":"actor_123e4567-e89b-42d3-a456-426614174001","capabilities":["capture.accept","space.write"],"role_claim_id":"role_claim_123e4567-e89b-42d3-a456-426614174003","role_id":"role_123e4567-e89b-42d3-a456-426614174002","tenant_id":"tenant_123e4567-e89b-42d3-a456-426614174000"},"schema_version":1,"sibling_context":{"proposal_ids":["proposal_123e4567-e89b-42d3-a456-426614174008","proposal_123e4567-e89b-42d3-a456-426614174018"]},"space_id":"space_123e4567-e89b-42d3-a456-426614174004","status":"pending","supplied_reason":"synthetic review evidence","tenant_id":"tenant_123e4567-e89b-42d3-a456-426614174000","trust":{"assessed_at":"2026-08-30T12:00:00Z","assessor_actor_id":"actor_123e4567-e89b-42d3-a456-426614174001","label":"owner","reason":"owner supplied synthetic fixture"}}